{
  "contract": { "name": "qa-fix/fix-result", "version": "1.0.0" },
  "skill": { "name": "qa-fix", "version": "0.2.0" },
  "generatedAt": "2026-07-24T10:40:00Z",
  "summary": "The login test's positional XPath no longer matches after a redesign; propose a role-based locator.",
  "classification": "repairable",
  "confidence": 0.85,
  "evidence": [
    { "type": "debug-result", "description": "qa-debug classified this as a locator-failure", "source": "qa-artifacts/debug-result.json" }
  ],
  "repairPlan": {
    "candidateType": "locator-update",
    "proposedChanges": [
      "Replace the positional XPath //div[3]/button with getByRole('button', { name: 'Sign in' }).",
      "Add a data-testid to the submit button if the role name is ambiguous."
    ],
    "affectedFiles": ["tests/login.spec.ts"],
    "risk": "low"
  },
  "permissionRequired": true,
  "rollbackStrategy": "Revert the single-line locator change; the assertion and flow are unchanged.",
  "diffGuardReview": { "status": "not-run", "note": "Plan only; when drafted, the guard must confirm no assertion is removed and no wait weakened." }
}
